{
  "id": "ca-fn-585",
  "castId": null,
  "name": "Popkum First Nation",
  "nameSource": {
    "kind": "isc-registered-name",
    "citation": "ISC First Nations location file, BAND_NAME for BAND_NUMBER 585",
    "url": "https://data.sac-isc.gc.ca/geomatics/rest/directories/arcgisoutput/DonneesOuvertes_OpenData/Premiere_Nation_First_Nation/",
    "retrievedAt": "2026-10-04"
  },
  "preferredName": null,
  "preferredNameSource": null,
  "aliases": [],
  "kind": "first-nation",
  "country": "CA",
  "jurisdictions": [
    "BC"
  ],
  "region": "bc",
  "hq": {
    "lat": 49.20193,
    "lon": -121.71946,
    "precision": "community",
    "sourceId": "isc-first-nations",
    "sourceRecordId": "585",
    "retrievedAt": "2026-10-04",
    "reviewed": false
  },
  "samples": [
    [
      49.20193,
      -121.71946
    ]
  ],
  "bbox": [
    -121.85694,
    49.1121,
    -121.58198,
    49.29176
  ],
  "boundary": {
    "status": "point-only",
    "detailRef": null,
    "parts": []
  },
  "timeZone": "America/Vancouver",
  "timeZoneSource": "tz-lookup",
  "units": "metric",
  "nws": null,
  "eccc": null,
  "radar": {
    "nexrad": null,
    "ridgeLoop": null,
    "eccc": null
  },
  "gauges": [],
  "contactIds": [],
  "website": null,
  "isc": {
    "bandNumber": 585,
    "tribalCouncil": "Sto:lo Nation"
  },
  "codes": {
    "biaLarIds": [],
    "censusAiannhce": [],
    "censusGeoid": null,
    "biaTldObjectId": null,
    "biaAnvObjectId": null,
    "iscBandNumber": 585
  },
  "review": {
    "status": "draft",
    "reviewedAt": null,
    "notes": "Draft built by scripts/reference/50-registry.mjs. BC basis: headquarters inside, or within 10 km of, the British Columbia outline; 4 reserve polygons joined through the ISC reserve relation."
  },
  "flags": []
}
