{
  "id": "ca-fn-638",
  "castId": null,
  "name": "Ka:'yu:'k't'h'/Che:k'tles7et'h' First Nations",
  "nameSource": {
    "kind": "isc-registered-name",
    "citation": "ISC First Nations location file, BAND_NAME for BAND_NUMBER 638",
    "url": "https://data.sac-isc.gc.ca/geomatics/rest/directories/arcgisoutput/DonneesOuvertes_OpenData/Premiere_Nation_First_Nation/",
    "retrievedAt": "2026-10-04"
  },
  "preferredName": null,
  "preferredNameSource": null,
  "aliases": [],
  "kind": "first-nation",
  "country": "CA",
  "jurisdictions": [
    "BC"
  ],
  "region": "bc",
  "hq": {
    "lat": 50.03057,
    "lon": -127.37823,
    "precision": "community",
    "sourceId": "isc-first-nations",
    "sourceRecordId": "638",
    "retrievedAt": "2026-10-04",
    "reviewed": true
  },
  "samples": [
    [
      50.03057,
      -127.37823
    ],
    [
      49.92386,
      -127.25541
    ]
  ],
  "bbox": [
    -127.25675,
    49.92278,
    -127.25418,
    49.92476
  ],
  "boundary": {
    "status": "polygon",
    "detailRef": "geo/boundaries/ca-fn-638.json",
    "parts": [
      {
        "sourceId": "nrcan-aboriginal-lands-bc",
        "featureId": "07130",
        "kind": "indian-reserve",
        "vintage": "2026-09-14"
      }
    ]
  },
  "timeZone": "America/Vancouver",
  "timeZoneSource": "tz-lookup",
  "units": "metric",
  "nws": null,
  "eccc": {
    "citypageId": "bc-89",
    "citypageName": "Port Hardy",
    "distanceKm": 77.2,
    "forecastZones": [
      "081400"
    ]
  },
  "radar": {
    "nexrad": "KLGX",
    "ridgeLoop": "KLGX",
    "eccc": null
  },
  "gauges": [],
  "contactIds": [],
  "website": null,
  "isc": {
    "bandNumber": 638,
    "tribalCouncil": "Nuu-Chah-Nulth Tribal Council"
  },
  "codes": {
    "biaLarIds": [],
    "censusAiannhce": [],
    "censusGeoid": null,
    "biaTldObjectId": null,
    "biaAnvObjectId": null,
    "iscBandNumber": 638
  },
  "review": {
    "status": "reviewed",
    "reviewedAt": "2026-10-05",
    "notes": "Approved with amendments 10/05/2026 (packet-amendments-2026-10-05.md; approver: maintainer). BC basis: headquarters inside, or within 10 km of, the British Columbia outline; 1 reserve polygon joined through the ISC reserve relation."
  },
  "flags": []
}
