{
  "id": "us-ak-central-council-of-the-tlingit-and-haida-indian-tribes",
  "castId": null,
  "name": "Central Council of the Tlingit & Haida Indian Tribes",
  "nameSource": {
    "kind": "federal-register",
    "citation": "Indian Entities Recognized by and Eligible To Receive Services From the United States Bureau of Indian Affairs, 91 FR 4102 (01/30/2026), FR Doc. 2026-01899; entry \"Central Council of the Tlingit & Haida Indian Tribes\"",
    "url": "https://www.federalregister.gov/documents/2026/01/30/2026-01899/indian-entities-recognized-by-and-eligible-to-receive-services-from-the-united-states-bureau-of",
    "retrievedAt": "2026-10-05"
  },
  "preferredName": null,
  "preferredNameSource": null,
  "aliases": [
    "Central Council",
    "Tlingit & Haida"
  ],
  "kind": "alaska-native-village",
  "country": "US",
  "jurisdictions": [
    "AK-SE"
  ],
  "region": "ak-se",
  "hq": {
    "lat": 58.36184,
    "lon": -134.5815,
    "precision": "office",
    "sourceId": "bia-anv",
    "sourceRecordId": "15",
    "retrievedAt": "2026-10-04",
    "reviewed": false
  },
  "samples": [
    [
      58.36184,
      -134.5815
    ]
  ],
  "bbox": [
    -134.75275,
    58.27201,
    -134.41025,
    58.45167
  ],
  "boundary": {
    "status": "point-only",
    "detailRef": null,
    "parts": []
  },
  "timeZone": "America/Juneau",
  "timeZoneSource": "tz-lookup",
  "units": "us",
  "nws": {
    "wfo": [
      "AJK"
    ],
    "point": [
      58.3618,
      -134.5815
    ],
    "forecastZones": [
      "forecast:AKZ325"
    ],
    "countyZones": [
      "county:AKC110"
    ],
    "fireZones": [
      "fire:AKZ325"
    ],
    "marineZones": [
      "marine:PKZ031"
    ]
  },
  "eccc": null,
  "radar": {
    "nexrad": "PACG",
    "ridgeLoop": "PACG",
    "eccc": null
  },
  "gauges": [],
  "contactIds": [],
  "website": null,
  "isc": null,
  "codes": {
    "biaLarIds": [],
    "censusAiannhce": [],
    "censusGeoid": null,
    "biaTldObjectId": 15,
    "biaAnvObjectId": 15,
    "iscBandNumber": null
  },
  "review": {
    "status": "draft",
    "reviewedAt": null,
    "notes": "Draft built by scripts/reference/50-registry.mjs. Footprint basis: borough or census area Juneau City and Borough (Q2 proposal, unratified)."
  },
  "flags": []
}
