{
  "id": "us-ca-yurok-tribe-of-the-yurok-reservation-california",
  "castId": null,
  "name": "Yurok Tribe of the Yurok Reservation, California",
  "nameSource": {
    "kind": "federal-register",
    "citation": "Indian Entities Recognized by and Eligible To Receive Services From the United States Bureau of Indian Affairs, 91 FR 4102 (01/30/2026), FR Doc. 2026-01899; entry \"Yurok Tribe of the Yurok Reservation, California\"",
    "url": "https://www.federalregister.gov/documents/2026/01/30/2026-01899/indian-entities-recognized-by-and-eligible-to-receive-services-from-the-united-states-bureau-of",
    "retrievedAt": "2026-10-05"
  },
  "preferredName": null,
  "preferredNameSource": null,
  "aliases": [
    "Yurok"
  ],
  "kind": "us-federally-recognized-tribe",
  "country": "US",
  "jurisdictions": [
    "CA-N"
  ],
  "region": "ca-n",
  "hq": {
    "lat": 41.52942,
    "lon": -124.0377,
    "precision": "office",
    "sourceId": "bia-tld",
    "sourceRecordId": "488",
    "retrievedAt": "2026-10-04",
    "reviewed": false
  },
  "samples": [
    [
      41.52942,
      -124.0377
    ]
  ],
  "bbox": [
    -124.1577,
    41.43959,
    -123.9177,
    41.61925
  ],
  "boundary": {
    "status": "point-only",
    "detailRef": null,
    "parts": []
  },
  "timeZone": "America/Los_Angeles",
  "timeZoneSource": "tz-lookup",
  "units": "us",
  "nws": null,
  "eccc": null,
  "radar": {
    "nexrad": null,
    "ridgeLoop": null,
    "eccc": null
  },
  "gauges": [],
  "contactIds": [],
  "website": null,
  "isc": null,
  "codes": {
    "biaLarIds": [
      "LAR0201"
    ],
    "censusAiannhce": [
      "4760"
    ],
    "censusGeoid": "4760R",
    "biaTldObjectId": 488,
    "biaAnvObjectId": null,
    "iscBandNumber": null
  },
  "review": {
    "status": "draft",
    "reviewedAt": null,
    "notes": "Draft built by scripts/reference/50-registry.mjs. Footprint basis: county Del Norte County (Q2 proposal, unratified)."
  },
  "flags": []
}
