{
  "id": "ca-fn-679",
  "castId": null,
  "name": "Nisga'a Village of Gitwinksihlkw",
  "nameSource": {
    "kind": "isc-registered-name",
    "citation": "ISC First Nations location file, BAND_NAME for BAND_NUMBER 679",
    "url": "https://data.sac-isc.gc.ca/geomatics/rest/directories/arcgisoutput/DonneesOuvertes_OpenData/Premiere_Nation_First_Nation/",
    "retrievedAt": "2026-10-04"
  },
  "preferredName": null,
  "preferredNameSource": null,
  "aliases": [],
  "kind": "first-nation",
  "country": "CA",
  "jurisdictions": [
    "BC"
  ],
  "region": "bc",
  "hq": {
    "lat": 55.19252,
    "lon": -129.2209,
    "precision": "community",
    "sourceId": "isc-first-nations",
    "sourceRecordId": "679",
    "retrievedAt": "2026-10-04",
    "reviewed": true
  },
  "samples": [
    [
      55.19252,
      -129.2209
    ]
  ],
  "bbox": [
    -129.37827,
    55.10269,
    -129.06353,
    55.28235
  ],
  "boundary": {
    "status": "point-only",
    "detailRef": null,
    "parts": []
  },
  "timeZone": "America/Vancouver",
  "timeZoneSource": "tz-lookup",
  "units": "metric",
  "nws": null,
  "eccc": {
    "citypageId": "bc-80",
    "citypageName": "Terrace",
    "distanceKm": 84.7,
    "forecastZones": [
      "089200"
    ]
  },
  "radar": {
    "nexrad": "PACG",
    "ridgeLoop": "PACG",
    "eccc": null
  },
  "gauges": [
    "wsc:08DB013",
    "wsc:08DB001"
  ],
  "contactIds": [],
  "website": null,
  "isc": {
    "bandNumber": 679,
    "tribalCouncil": null
  },
  "codes": {
    "biaLarIds": [],
    "censusAiannhce": [],
    "censusGeoid": null,
    "biaTldObjectId": null,
    "biaAnvObjectId": null,
    "iscBandNumber": 679
  },
  "review": {
    "status": "reviewed",
    "reviewedAt": "2026-10-05",
    "notes": "Approved with amendments 10/05/2026 (packet-amendments-2026-10-05.md; approver: maintainer). BC basis: headquarters inside, or within 10 km of, the British Columbia outline; 0 reserve polygons joined through the ISC reserve relation."
  },
  "flags": []
}
