{
  "id": "us-ca-elem-indian-colony-of-pomo-indians-of-the-sulphur-bank-rancheria-california",
  "castId": null,
  "name": "Elem Indian Colony of Pomo Indians of the Sulphur Bank Rancheria, California",
  "nameSource": {
    "kind": "federal-register",
    "citation": "Indian Entities Recognized by and Eligible To Receive Services From the United States Bureau of Indian Affairs, 91 FR 4102 (01/30/2026), FR Doc. 2026-01899; entry \"Elem Indian Colony of Pomo Indians of the Sulphur Bank Rancheria, California\"",
    "url": "https://www.federalregister.gov/documents/2026/01/30/2026-01899/indian-entities-recognized-by-and-eligible-to-receive-services-from-the-united-states-bureau-of",
    "retrievedAt": "2026-10-05"
  },
  "preferredName": null,
  "preferredNameSource": null,
  "aliases": [
    "Elem",
    "Elem Indian Colony"
  ],
  "kind": "us-federally-recognized-tribe",
  "country": "US",
  "jurisdictions": [
    "CA-N"
  ],
  "region": "ca-n",
  "hq": {
    "lat": 38.45184,
    "lon": -122.7344,
    "precision": "office",
    "sourceId": "bia-tld",
    "sourceRecordId": "413",
    "retrievedAt": "2026-10-04",
    "reviewed": false
  },
  "samples": [
    [
      38.45184,
      -122.7344
    ]
  ],
  "bbox": [
    -122.84911,
    38.36201,
    -122.61969,
    38.54167
  ],
  "boundary": {
    "status": "point-only",
    "detailRef": null,
    "parts": []
  },
  "timeZone": "America/Los_Angeles",
  "timeZoneSource": "tz-lookup",
  "units": "us",
  "nws": null,
  "eccc": null,
  "radar": {
    "nexrad": null,
    "ridgeLoop": null,
    "eccc": null
  },
  "gauges": [],
  "contactIds": [],
  "website": null,
  "isc": null,
  "codes": {
    "biaLarIds": [
      "LAR0125"
    ],
    "censusAiannhce": [],
    "censusGeoid": null,
    "biaTldObjectId": 413,
    "biaAnvObjectId": null,
    "iscBandNumber": null
  },
  "review": {
    "status": "draft",
    "reviewedAt": null,
    "notes": "Draft built by scripts/reference/50-registry.mjs. Footprint basis: scope.yaml include: The reservation lies in Lake County, which is on the northern California list; the Directory office point is in Santa Rosa (Sonoma County), so the headquarters rule alone would leave it out.."
  },
  "flags": []
}
