{
  "id": "us-wa-jamestown-sklallam-tribe",
  "castId": null,
  "name": "Jamestown S'Klallam Tribe",
  "nameSource": {
    "kind": "federal-register",
    "citation": "Indian Entities Recognized by and Eligible To Receive Services From the United States Bureau of Indian Affairs, 91 FR 4102 (01/30/2026), FR Doc. 2026-01899; entry \"Jamestown S'Klallam Tribe\"",
    "url": "https://www.federalregister.gov/documents/2026/01/30/2026-01899/indian-entities-recognized-by-and-eligible-to-receive-services-from-the-united-states-bureau-of",
    "retrievedAt": "2026-10-05"
  },
  "preferredName": null,
  "preferredNameSource": null,
  "aliases": [
    "Jamestown",
    "Jamestown S'Klallam"
  ],
  "kind": "us-federally-recognized-tribe",
  "country": "US",
  "jurisdictions": [
    "WA"
  ],
  "region": "wa",
  "hq": {
    "lat": 48.0255,
    "lon": -122.9963,
    "precision": "office",
    "sourceId": "bia-tld",
    "sourceRecordId": "354",
    "retrievedAt": "2026-10-04",
    "reviewed": false
  },
  "samples": [
    [
      48.0255,
      -122.9963
    ],
    [
      48.02625,
      -122.99889
    ]
  ],
  "bbox": [
    -123.1513,
    48.02437,
    -122.997,
    48.0708
  ],
  "boundary": {
    "status": "polygon",
    "detailRef": "geo/boundaries/us-wa-jamestown-sklallam-tribe.json",
    "parts": [
      {
        "sourceId": "bia-lar",
        "featureId": "LAR0064",
        "kind": "land-area-representation",
        "vintage": "2026-10-04"
      }
    ]
  },
  "timeZone": "America/Los_Angeles",
  "timeZoneSource": "tz-lookup",
  "units": "us",
  "nws": {
    "wfo": [
      "SEW"
    ],
    "point": [
      48.0255,
      -122.9963
    ],
    "forecastZones": [
      "forecast:WAZ325"
    ],
    "countyZones": [
      "county:WAC009"
    ],
    "fireZones": [
      "fire:WAZ653"
    ],
    "marineZones": [
      "marine:PZZ132"
    ]
  },
  "eccc": null,
  "radar": {
    "nexrad": "KATX",
    "ridgeLoop": "KATX",
    "eccc": null
  },
  "gauges": [
    "nwps:DRSW1",
    "nwps:DRMW1"
  ],
  "contactIds": [],
  "website": null,
  "isc": null,
  "codes": {
    "biaLarIds": [
      "LAR0064"
    ],
    "censusAiannhce": [
      "1655"
    ],
    "censusGeoid": "1655R",
    "biaTldObjectId": 354,
    "biaAnvObjectId": null,
    "iscBandNumber": null
  },
  "review": {
    "status": "draft",
    "reviewedAt": null,
    "notes": "Draft built by scripts/reference/50-registry.mjs. Footprint basis: state Washington (whole state is in the footprint)."
  },
  "flags": []
}
