{
  "id": "us-ca-manchester-band-of-pomo-indians-of-the-manchester-rancheria-california",
  "castId": null,
  "name": "Manchester Band of Pomo Indians of the Manchester Rancheria, California",
  "nameSource": {
    "kind": "federal-register",
    "citation": "Indian Entities Recognized by and Eligible To Receive Services From the United States Bureau of Indian Affairs, 91 FR 4102 (01/30/2026), FR Doc. 2026-01899; entry \"Manchester Band of Pomo Indians of the Manchester Rancheria, California\"",
    "url": "https://www.federalregister.gov/documents/2026/01/30/2026-01899/indian-entities-recognized-by-and-eligible-to-receive-services-from-the-united-states-bureau-of",
    "retrievedAt": "2026-10-05"
  },
  "preferredName": null,
  "preferredNameSource": null,
  "aliases": [
    "Manchester",
    "Manchester Rancheria"
  ],
  "kind": "us-federally-recognized-tribe",
  "country": "US",
  "jurisdictions": [
    "CA-N"
  ],
  "region": "ca-n",
  "hq": {
    "lat": 38.93687,
    "lon": -123.6821,
    "precision": "office",
    "sourceId": "bia-tld",
    "sourceRecordId": "440",
    "retrievedAt": "2026-10-04",
    "reviewed": false
  },
  "samples": [
    [
      38.93687,
      -123.6821
    ],
    [
      38.93532,
      -123.68239
    ]
  ],
  "bbox": [
    -123.69151,
    38.9293,
    -123.65805,
    38.95476
  ],
  "boundary": {
    "status": "polygon",
    "detailRef": "geo/boundaries/us-ca-manchester-band-of-pomo-indians-of-the-manchester-rancheria-california.json",
    "parts": [
      {
        "sourceId": "bia-lar",
        "featureId": "LAR0148",
        "kind": "land-area-representation",
        "vintage": "2026-10-04"
      }
    ]
  },
  "timeZone": "America/Los_Angeles",
  "timeZoneSource": "tz-lookup",
  "units": "us",
  "nws": {
    "wfo": [
      "EKA"
    ],
    "point": [
      38.9369,
      -123.6821
    ],
    "forecastZones": [
      "forecast:CAZ109"
    ],
    "countyZones": [
      "county:CAC045"
    ],
    "fireZones": [
      "fire:CAZ413"
    ],
    "marineZones": [
      "marine:PZZ540",
      "marine:PZZ455"
    ]
  },
  "eccc": null,
  "radar": {
    "nexrad": "KDAX",
    "ridgeLoop": "KDAX",
    "eccc": null
  },
  "gauges": [],
  "contactIds": [],
  "website": null,
  "isc": null,
  "codes": {
    "biaLarIds": [
      "LAR0148"
    ],
    "censusAiannhce": [
      "2100"
    ],
    "censusGeoid": "2100R",
    "biaTldObjectId": 440,
    "biaAnvObjectId": null,
    "iscBandNumber": null
  },
  "review": {
    "status": "draft",
    "reviewedAt": null,
    "notes": "Draft built by scripts/reference/50-registry.mjs. Footprint basis: county Mendocino County (Q2 proposal, unratified)."
  },
  "flags": []
}
