{
  "id": "us-ca-paskenta-band-of-nomlaki-indians-of-california",
  "castId": null,
  "name": "Paskenta Band of Nomlaki Indians of California",
  "nameSource": {
    "kind": "federal-register",
    "citation": "Indian Entities Recognized by and Eligible To Receive Services From the United States Bureau of Indian Affairs, 91 FR 4102 (01/30/2026), FR Doc. 2026-01899; entry \"Paskenta Band of Nomlaki Indians of California\"",
    "url": "https://www.federalregister.gov/documents/2026/01/30/2026-01899/indian-entities-recognized-by-and-eligible-to-receive-services-from-the-united-states-bureau-of",
    "retrievedAt": "2026-10-05"
  },
  "preferredName": null,
  "preferredNameSource": null,
  "aliases": [
    "Paskenta"
  ],
  "kind": "us-federally-recognized-tribe",
  "country": "US",
  "jurisdictions": [
    "CA-N"
  ],
  "region": "ca-n",
  "hq": {
    "lat": 39.88002,
    "lon": -122.1961,
    "precision": "office",
    "sourceId": "bia-tld",
    "sourceRecordId": "449",
    "retrievedAt": "2026-10-04",
    "reviewed": true
  },
  "samples": [
    [
      39.88002,
      -122.1961
    ],
    [
      39.86789,
      -122.22175
    ]
  ],
  "bbox": [
    -122.24422,
    39.85632,
    -122.19039,
    39.88173
  ],
  "boundary": {
    "status": "polygon",
    "detailRef": "geo/boundaries/us-ca-paskenta-band-of-nomlaki-indians-of-california.json",
    "parts": [
      {
        "sourceId": "bia-lar",
        "featureId": "LAR0157",
        "kind": "land-area-representation",
        "vintage": "2026-10-04"
      }
    ]
  },
  "timeZone": "America/Los_Angeles",
  "timeZoneSource": "tz-lookup",
  "units": "us",
  "nws": {
    "wfo": [
      "STO"
    ],
    "point": [
      39.88,
      -122.1961
    ],
    "forecastZones": [
      "forecast:CAZ142"
    ],
    "countyZones": [
      "county:CAC103"
    ],
    "fireZones": [
      "fire:CAZ142"
    ],
    "marineZones": []
  },
  "eccc": null,
  "radar": {
    "nexrad": "KBBX",
    "ridgeLoop": "KBBX",
    "eccc": null
  },
  "gauges": [],
  "contactIds": [],
  "website": null,
  "isc": null,
  "codes": {
    "biaLarIds": [
      "LAR0157"
    ],
    "censusAiannhce": [
      "2685"
    ],
    "censusGeoid": "2685R",
    "biaTldObjectId": 449,
    "biaAnvObjectId": null,
    "iscBandNumber": null
  },
  "review": {
    "status": "reviewed",
    "reviewedAt": "2026-10-05",
    "notes": "Approved with amendments 10/05/2026 (packet-amendments-2026-10-05.md; approver: maintainer). Footprint basis: county Tehama County (footprint.yaml, ratified 10/05/2026)."
  },
  "flags": []
}
