{
  "id": "us-ak-metlakatla-indian-community-annette-island-reserve",
  "castId": null,
  "name": "Metlakatla Indian Community, Annette Island Reserve",
  "nameSource": {
    "kind": "federal-register",
    "citation": "Indian Entities Recognized by and Eligible To Receive Services From the United States Bureau of Indian Affairs, 91 FR 4102 (01/30/2026), FR Doc. 2026-01899; entry \"Metlakatla Indian Community, Annette Island Reserve\"",
    "url": "https://www.federalregister.gov/documents/2026/01/30/2026-01899/indian-entities-recognized-by-and-eligible-to-receive-services-from-the-united-states-bureau-of",
    "retrievedAt": "2026-10-05"
  },
  "preferredName": null,
  "preferredNameSource": null,
  "aliases": [
    "Metlakatla"
  ],
  "kind": "us-federally-recognized-tribe",
  "country": "US",
  "jurisdictions": [
    "AK-SE"
  ],
  "region": "ak-se",
  "hq": {
    "lat": 55.12617,
    "lon": -131.5734,
    "precision": "office",
    "sourceId": "bia-tld",
    "sourceRecordId": "361",
    "retrievedAt": "2026-10-04",
    "reviewed": false
  },
  "samples": [
    [
      55.12617,
      -131.5734
    ],
    [
      55.12639,
      -131.49578
    ]
  ],
  "bbox": [
    -131.66697,
    54.98566,
    -131.29391,
    55.29398
  ],
  "boundary": {
    "status": "polygon",
    "detailRef": "geo/boundaries/us-ak-metlakatla-indian-community-annette-island-reserve.json",
    "parts": [
      {
        "sourceId": "bia-lar",
        "featureId": "LAR0053",
        "kind": "land-area-representation",
        "vintage": "2026-10-04"
      }
    ]
  },
  "timeZone": "America/Sitka",
  "timeZoneSource": "tz-lookup",
  "units": "us",
  "nws": {
    "wfo": [
      "AJK"
    ],
    "point": [
      55.1262,
      -131.5734
    ],
    "forecastZones": [
      "forecast:AKZ332"
    ],
    "countyZones": [
      "county:AKC198"
    ],
    "fireZones": [
      "fire:AKZ332"
    ],
    "marineZones": [
      "marine:PKZ036"
    ]
  },
  "eccc": null,
  "radar": {
    "nexrad": "PACG",
    "ridgeLoop": "PACG",
    "eccc": null
  },
  "gauges": [],
  "contactIds": [],
  "website": null,
  "isc": null,
  "codes": {
    "biaLarIds": [
      "LAR0053"
    ],
    "censusAiannhce": [
      "0110"
    ],
    "censusGeoid": "0110R",
    "biaTldObjectId": 361,
    "biaAnvObjectId": null,
    "iscBandNumber": null
  },
  "review": {
    "status": "draft",
    "reviewedAt": null,
    "notes": "Draft built by scripts/reference/50-registry.mjs. Footprint basis: borough or census area Prince of Wales-Hyder Census Area (Q2 proposal, unratified)."
  },
  "flags": []
}
