{
  "id": "us-wa-puyallup-tribe-of-the-puyallup-reservation",
  "castId": null,
  "name": "Puyallup Tribe of the Puyallup Reservation",
  "nameSource": {
    "kind": "federal-register",
    "citation": "Indian Entities Recognized by and Eligible To Receive Services From the United States Bureau of Indian Affairs, 91 FR 4102 (01/30/2026), FR Doc. 2026-01899; entry \"Puyallup Tribe of the Puyallup Reservation\"",
    "url": "https://www.federalregister.gov/documents/2026/01/30/2026-01899/indian-entities-recognized-by-and-eligible-to-receive-services-from-the-united-states-bureau-of",
    "retrievedAt": "2026-10-05"
  },
  "preferredName": null,
  "preferredNameSource": null,
  "aliases": [
    "Puyallup"
  ],
  "kind": "us-federally-recognized-tribe",
  "country": "US",
  "jurisdictions": [
    "WA"
  ],
  "region": "wa",
  "hq": {
    "lat": 47.23632,
    "lon": -122.4096,
    "precision": "office",
    "sourceId": "bia-tld",
    "sourceRecordId": "368",
    "retrievedAt": "2026-10-04",
    "reviewed": false
  },
  "samples": [
    [
      47.23632,
      -122.4096
    ],
    [
      47.24017,
      -122.36891
    ]
  ],
  "bbox": [
    -122.44454,
    47.18686,
    -122.30217,
    47.32017
  ],
  "boundary": {
    "status": "polygon",
    "detailRef": "geo/boundaries/us-wa-puyallup-tribe-of-the-puyallup-reservation.json",
    "parts": [
      {
        "sourceId": "bia-lar",
        "featureId": "LAR0078",
        "kind": "land-area-representation",
        "vintage": "2026-10-04"
      }
    ]
  },
  "timeZone": "America/Los_Angeles",
  "timeZoneSource": "tz-lookup",
  "units": "us",
  "nws": {
    "wfo": [
      "SEW"
    ],
    "point": [
      47.2363,
      -122.4096
    ],
    "forecastZones": [
      "forecast:WAZ316"
    ],
    "countyZones": [
      "county:WAC053",
      "county:WAC033"
    ],
    "fireZones": [
      "fire:WAZ654",
      "fire:WAZ657"
    ],
    "marineZones": [
      "marine:PZZ135"
    ]
  },
  "eccc": null,
  "radar": {
    "nexrad": "KATX",
    "ridgeLoop": "KATX",
    "eccc": null
  },
  "gauges": [
    "nwps:PUYW1",
    "nwps:WRAW1",
    "nwps:AUBW1",
    "nwps:BSKW1",
    "nwps:SPEW1",
    "nwps:BKDW1"
  ],
  "contactIds": [],
  "website": null,
  "isc": null,
  "codes": {
    "biaLarIds": [
      "LAR0078"
    ],
    "censusAiannhce": [
      "3000"
    ],
    "censusGeoid": "3000R",
    "biaTldObjectId": 368,
    "biaAnvObjectId": null,
    "iscBandNumber": null
  },
  "review": {
    "status": "draft",
    "reviewedAt": null,
    "notes": "Draft built by scripts/reference/50-registry.mjs. Footprint basis: state Washington (whole state is in the footprint)."
  },
  "flags": []
}
