{
  "id": "us-id-coeur-dalene-tribe",
  "castId": null,
  "name": "Coeur D'Alene Tribe",
  "nameSource": {
    "kind": "federal-register",
    "citation": "Indian Entities Recognized by and Eligible To Receive Services From the United States Bureau of Indian Affairs, 91 FR 4102 (01/30/2026), FR Doc. 2026-01899; entry \"Coeur D'Alene Tribe\"",
    "url": "https://www.federalregister.gov/documents/2026/01/30/2026-01899/indian-entities-recognized-by-and-eligible-to-receive-services-from-the-united-states-bureau-of",
    "retrievedAt": "2026-10-05"
  },
  "preferredName": null,
  "preferredNameSource": null,
  "aliases": [
    "Coeur D'Alene"
  ],
  "kind": "us-federally-recognized-tribe",
  "country": "US",
  "jurisdictions": [
    "ID"
  ],
  "region": "id",
  "hq": {
    "lat": 47.33772,
    "lon": -116.8867,
    "precision": "office",
    "sourceId": "bia-tld",
    "sourceRecordId": "340",
    "retrievedAt": "2026-10-04",
    "reviewed": false
  },
  "samples": [
    [
      47.33772,
      -116.8867
    ],
    [
      47.2932,
      -116.83371
    ]
  ],
  "bbox": [
    -117.04036,
    47.04336,
    -116.45093,
    47.52347
  ],
  "boundary": {
    "status": "polygon",
    "detailRef": "geo/boundaries/us-id-coeur-dalene-tribe.json",
    "parts": [
      {
        "sourceId": "bia-lar",
        "featureId": "LAR0056",
        "kind": "land-area-representation",
        "vintage": "2026-10-04"
      }
    ]
  },
  "timeZone": "America/Los_Angeles",
  "timeZoneSource": "tz-lookup",
  "units": "us",
  "nws": {
    "wfo": [
      "OTX"
    ],
    "point": [
      47.3377,
      -116.8867
    ],
    "forecastZones": [
      "forecast:IDZ003",
      "forecast:IDZ002",
      "forecast:IDZ004"
    ],
    "countyZones": [
      "county:IDC009",
      "county:IDC055"
    ],
    "fireZones": [
      "fire:IDZ101"
    ],
    "marineZones": []
  },
  "eccc": null,
  "radar": {
    "nexrad": "KOTX",
    "ridgeLoop": "KOTX",
    "eccc": null
  },
  "gauges": [
    "nwps:SJRI1",
    "nwps:HCTW1",
    "nwps:HARI1",
    "nwps:SJMI1"
  ],
  "contactIds": [],
  "website": null,
  "isc": null,
  "codes": {
    "biaLarIds": [
      "LAR0056"
    ],
    "censusAiannhce": [
      "0705"
    ],
    "censusGeoid": "0705R",
    "biaTldObjectId": 340,
    "biaAnvObjectId": null,
    "iscBandNumber": null
  },
  "review": {
    "status": "draft",
    "reviewedAt": null,
    "notes": "Draft built by scripts/reference/50-registry.mjs. Footprint basis: state Idaho (whole state is in the footprint)."
  },
  "flags": []
}
