{
  "id": "us-ca-habematolel-pomo-of-upper-lake-california",
  "castId": null,
  "name": "Habematolel Pomo of Upper Lake, California",
  "nameSource": {
    "kind": "federal-register",
    "citation": "Indian Entities Recognized by and Eligible To Receive Services From the United States Bureau of Indian Affairs, 91 FR 4102 (01/30/2026), FR Doc. 2026-01899; entry \"Habematolel Pomo of Upper Lake, California\"",
    "url": "https://www.federalregister.gov/documents/2026/01/30/2026-01899/indian-entities-recognized-by-and-eligible-to-receive-services-from-the-united-states-bureau-of",
    "retrievedAt": "2026-10-05"
  },
  "preferredName": null,
  "preferredNameSource": null,
  "aliases": [
    "Habematolel",
    "Upper Lake Rancheria"
  ],
  "kind": "us-federally-recognized-tribe",
  "country": "US",
  "jurisdictions": [
    "CA-N"
  ],
  "region": "ca-n",
  "hq": {
    "lat": 39.16417,
    "lon": -122.9106,
    "precision": "office",
    "sourceId": "bia-tld",
    "sourceRecordId": "423",
    "retrievedAt": "2026-10-04",
    "reviewed": false
  },
  "samples": [
    [
      39.16417,
      -122.9106
    ],
    [
      39.18595,
      -122.91901
    ]
  ],
  "bbox": [
    -122.95733,
    39.1585,
    -122.90295,
    39.24656
  ],
  "boundary": {
    "status": "polygon",
    "detailRef": "geo/boundaries/us-ca-habematolel-pomo-of-upper-lake-california.json",
    "parts": [
      {
        "sourceId": "bia-lar",
        "featureId": "LAR0196",
        "kind": "land-area-representation",
        "vintage": "2026-10-04"
      }
    ]
  },
  "timeZone": "America/Los_Angeles",
  "timeZoneSource": "tz-lookup",
  "units": "us",
  "nws": {
    "wfo": [
      "EKA"
    ],
    "point": [
      39.1642,
      -122.9106
    ],
    "forecastZones": [
      "forecast:CAZ118",
      "forecast:CAZ114"
    ],
    "countyZones": [
      "county:CAC033"
    ],
    "fireZones": [
      "fire:CAZ421",
      "fire:CAZ418"
    ],
    "marineZones": []
  },
  "eccc": null,
  "radar": {
    "nexrad": "KBBX",
    "ridgeLoop": "KBBX",
    "eccc": null
  },
  "gauges": [],
  "contactIds": [],
  "website": null,
  "isc": null,
  "codes": {
    "biaLarIds": [
      "LAR0196"
    ],
    "censusAiannhce": [
      "4430"
    ],
    "censusGeoid": "4430R",
    "biaTldObjectId": 423,
    "biaAnvObjectId": null,
    "iscBandNumber": null
  },
  "review": {
    "status": "draft",
    "reviewedAt": null,
    "notes": "Draft built by scripts/reference/50-registry.mjs. Footprint basis: county Lake County (Q2 proposal, unratified)."
  },
  "flags": []
}
