{
  "id": "us-ca-big-valley-band-of-pomo-indians-of-the-big-valley-rancheria-california",
  "castId": null,
  "name": "Big Valley Band of Pomo Indians of the Big Valley Rancheria, California",
  "nameSource": {
    "kind": "federal-register",
    "citation": "Indian Entities Recognized by and Eligible To Receive Services From the United States Bureau of Indian Affairs, 91 FR 4102 (01/30/2026), FR Doc. 2026-01899; entry \"Big Valley Band of Pomo Indians of the Big Valley Rancheria, California\"",
    "url": "https://www.federalregister.gov/documents/2026/01/30/2026-01899/indian-entities-recognized-by-and-eligible-to-receive-services-from-the-united-states-bureau-of",
    "retrievedAt": "2026-10-05"
  },
  "preferredName": null,
  "preferredNameSource": null,
  "aliases": [
    "Big Valley Rancheria"
  ],
  "kind": "us-federally-recognized-tribe",
  "country": "US",
  "jurisdictions": [
    "CA-N"
  ],
  "region": "ca-n",
  "hq": {
    "lat": 39.02211,
    "lon": -122.8872,
    "precision": "office",
    "sourceId": "bia-tld",
    "sourceRecordId": "392",
    "retrievedAt": "2026-10-04",
    "reviewed": false
  },
  "samples": [
    [
      39.02211,
      -122.8872
    ]
  ],
  "bbox": [
    -123.00283,
    38.93228,
    -122.77157,
    39.11194
  ],
  "boundary": {
    "status": "point-only",
    "detailRef": null,
    "parts": []
  },
  "timeZone": "America/Los_Angeles",
  "timeZoneSource": "tz-lookup",
  "units": "us",
  "nws": null,
  "eccc": null,
  "radar": {
    "nexrad": null,
    "ridgeLoop": null,
    "eccc": null
  },
  "gauges": [],
  "contactIds": [],
  "website": null,
  "isc": null,
  "codes": {
    "biaLarIds": [],
    "censusAiannhce": [],
    "censusGeoid": null,
    "biaTldObjectId": 392,
    "biaAnvObjectId": null,
    "iscBandNumber": null
  },
  "review": {
    "status": "draft",
    "reviewedAt": null,
    "notes": "Draft built by scripts/reference/50-registry.mjs. Footprint basis: county Lake County (Q2 proposal, unratified)."
  },
  "flags": []
}
