{
  "id": "ca-fn-681",
  "castId": null,
  "name": "Kitsumkalum",
  "nameSource": {
    "kind": "isc-registered-name",
    "citation": "ISC First Nations location file, BAND_NAME for BAND_NUMBER 681",
    "url": "https://data.sac-isc.gc.ca/geomatics/rest/directories/arcgisoutput/DonneesOuvertes_OpenData/Premiere_Nation_First_Nation/",
    "retrievedAt": "2026-10-04"
  },
  "preferredName": null,
  "preferredNameSource": null,
  "aliases": [],
  "kind": "first-nation",
  "country": "CA",
  "jurisdictions": [
    "BC"
  ],
  "region": "bc",
  "hq": {
    "lat": 54.52289,
    "lon": -128.66733,
    "precision": "community",
    "sourceId": "isc-first-nations",
    "sourceRecordId": "681",
    "retrievedAt": "2026-10-04",
    "reviewed": false
  },
  "samples": [
    [
      54.52289,
      -128.66733
    ],
    [
      54.52916,
      -128.67462
    ],
    [
      54.58661,
      -128.66758
    ],
    [
      54.48342,
      -128.73868
    ],
    [
      54.15572,
      -129.96992
    ]
  ],
  "bbox": [
    -129.97133,
    54.15488,
    -128.65232,
    54.59088
  ],
  "boundary": {
    "status": "polygon",
    "detailRef": "geo/boundaries/ca-fn-681.json",
    "parts": [
      {
        "sourceId": "nrcan-aboriginal-lands-bc",
        "featureId": "07646",
        "kind": "indian-reserve",
        "vintage": "2026-09-14"
      },
      {
        "sourceId": "nrcan-aboriginal-lands-bc",
        "featureId": "07647",
        "kind": "indian-reserve",
        "vintage": "2026-09-14"
      },
      {
        "sourceId": "nrcan-aboriginal-lands-bc",
        "featureId": "07648",
        "kind": "indian-reserve",
        "vintage": "2026-09-14"
      },
      {
        "sourceId": "nrcan-aboriginal-lands-bc",
        "featureId": "07649",
        "kind": "indian-reserve",
        "vintage": "2026-09-14"
      }
    ]
  },
  "timeZone": "America/Vancouver",
  "timeZoneSource": "tz-lookup",
  "units": "metric",
  "nws": null,
  "eccc": {
    "citypageId": "bc-80",
    "citypageName": "Terrace",
    "distanceKm": 4.4,
    "forecastZones": [
      "089200",
      "089100"
    ]
  },
  "radar": {
    "nexrad": null,
    "ridgeLoop": null,
    "eccc": null
  },
  "gauges": [
    "wsc:08EG019",
    "wsc:08EF001",
    "wsc:08EF005"
  ],
  "contactIds": [],
  "website": null,
  "isc": {
    "bandNumber": 681,
    "tribalCouncil": null
  },
  "codes": {
    "biaLarIds": [],
    "censusAiannhce": [],
    "censusGeoid": null,
    "biaTldObjectId": null,
    "biaAnvObjectId": null,
    "iscBandNumber": 681
  },
  "review": {
    "status": "draft",
    "reviewedAt": null,
    "notes": "Draft built by scripts/reference/50-registry.mjs. BC basis: headquarters inside, or within 10 km of, the British Columbia outline; 4 reserve polygons joined through the ISC reserve relation."
  },
  "flags": []
}
