{
  "id": "us-ak-sitka-tribe-of-alaska",
  "castId": null,
  "name": "Sitka Tribe of Alaska",
  "nameSource": {
    "kind": "federal-register",
    "citation": "Indian Entities Recognized by and Eligible To Receive Services From the United States Bureau of Indian Affairs, 91 FR 4102 (01/30/2026), FR Doc. 2026-01899; entry \"Sitka Tribe of Alaska\"",
    "url": "https://www.federalregister.gov/documents/2026/01/30/2026-01899/indian-entities-recognized-by-and-eligible-to-receive-services-from-the-united-states-bureau-of",
    "retrievedAt": "2026-10-05"
  },
  "preferredName": null,
  "preferredNameSource": null,
  "aliases": [
    "Sitka"
  ],
  "kind": "alaska-native-village",
  "country": "US",
  "jurisdictions": [
    "AK-SE"
  ],
  "region": "ak-se",
  "hq": {
    "lat": 57.05696,
    "lon": -135.3482,
    "precision": "office",
    "sourceId": "bia-anv",
    "sourceRecordId": "193",
    "retrievedAt": "2026-10-04",
    "reviewed": false
  },
  "samples": [
    [
      57.05696,
      -135.3482
    ]
  ],
  "bbox": [
    -135.51339,
    56.96713,
    -135.18301,
    57.14679
  ],
  "boundary": {
    "status": "point-only",
    "detailRef": null,
    "parts": []
  },
  "timeZone": "America/Sitka",
  "timeZoneSource": "tz-lookup",
  "units": "us",
  "nws": {
    "wfo": [
      "AJK"
    ],
    "point": [
      57.057,
      -135.3482
    ],
    "forecastZones": [
      "forecast:AKZ323"
    ],
    "countyZones": [
      "county:AKC220"
    ],
    "fireZones": [
      "fire:AKZ323"
    ],
    "marineZones": [
      "marine:PKZ642"
    ]
  },
  "eccc": null,
  "radar": {
    "nexrad": "PACG",
    "ridgeLoop": "PACG",
    "eccc": null
  },
  "gauges": [],
  "contactIds": [],
  "website": null,
  "isc": null,
  "codes": {
    "biaLarIds": [],
    "censusAiannhce": [],
    "censusGeoid": null,
    "biaTldObjectId": 193,
    "biaAnvObjectId": 193,
    "iscBandNumber": null
  },
  "review": {
    "status": "draft",
    "reviewedAt": null,
    "notes": "Draft built by scripts/reference/50-registry.mjs. Footprint basis: borough or census area Sitka City and Borough (Q2 proposal, unratified)."
  },
  "flags": []
}
