{
  "id": "us-ca-coyote-valley-band-of-pomo-indians-of-california",
  "castId": null,
  "name": "Coyote Valley Band of Pomo Indians of California",
  "nameSource": {
    "kind": "federal-register",
    "citation": "Indian Entities Recognized by and Eligible To Receive Services From the United States Bureau of Indian Affairs, 91 FR 4102 (01/30/2026), FR Doc. 2026-01899; entry \"Coyote Valley Band of Pomo Indians of California\"",
    "url": "https://www.federalregister.gov/documents/2026/01/30/2026-01899/indian-entities-recognized-by-and-eligible-to-receive-services-from-the-united-states-bureau-of",
    "retrievedAt": "2026-10-05"
  },
  "preferredName": null,
  "preferredNameSource": null,
  "aliases": [
    "Coyote Valley"
  ],
  "kind": "us-federally-recognized-tribe",
  "country": "US",
  "jurisdictions": [
    "CA-N"
  ],
  "region": "ca-n",
  "hq": {
    "lat": 39.25325,
    "lon": -123.2111,
    "precision": "office",
    "sourceId": "bia-tld",
    "sourceRecordId": "411",
    "retrievedAt": "2026-10-04",
    "reviewed": false
  },
  "samples": [
    [
      39.25325,
      -123.2111
    ],
    [
      39.25393,
      -123.20763
    ]
  ],
  "bbox": [
    -123.21593,
    39.25094,
    -123.20379,
    39.25652
  ],
  "boundary": {
    "status": "polygon",
    "detailRef": "geo/boundaries/us-ca-coyote-valley-band-of-pomo-indians-of-california.json",
    "parts": [
      {
        "sourceId": "bia-lar",
        "featureId": "LAR0122",
        "kind": "land-area-representation",
        "vintage": "2026-10-04"
      }
    ]
  },
  "timeZone": "America/Los_Angeles",
  "timeZoneSource": "tz-lookup",
  "units": "us",
  "nws": {
    "wfo": [
      "EKA"
    ],
    "point": [
      39.2533,
      -123.2111
    ],
    "forecastZones": [
      "forecast:CAZ113"
    ],
    "countyZones": [
      "county:CAC045"
    ],
    "fireZones": [
      "fire:CAZ416"
    ],
    "marineZones": []
  },
  "eccc": null,
  "radar": {
    "nexrad": "KBBX",
    "ridgeLoop": "KBBX",
    "eccc": null
  },
  "gauges": [],
  "contactIds": [],
  "website": null,
  "isc": null,
  "codes": {
    "biaLarIds": [
      "LAR0122"
    ],
    "censusAiannhce": [
      "0825"
    ],
    "censusGeoid": "0825R",
    "biaTldObjectId": 411,
    "biaAnvObjectId": null,
    "iscBandNumber": null
  },
  "review": {
    "status": "draft",
    "reviewedAt": null,
    "notes": "Draft built by scripts/reference/50-registry.mjs. Footprint basis: county Mendocino County (Q2 proposal, unratified)."
  },
  "flags": []
}
