{
  "id": "us-id-nez-perce-tribe",
  "castId": null,
  "name": "Nez Perce Tribe",
  "nameSource": {
    "kind": "federal-register",
    "citation": "Indian Entities Recognized by and Eligible To Receive Services From the United States Bureau of Indian Affairs, 91 FR 4102 (01/30/2026), FR Doc. 2026-01899; entry \"Nez Perce Tribe\"",
    "url": "https://www.federalregister.gov/documents/2026/01/30/2026-01899/indian-entities-recognized-by-and-eligible-to-receive-services-from-the-united-states-bureau-of",
    "retrievedAt": "2026-10-05"
  },
  "preferredName": null,
  "preferredNameSource": null,
  "aliases": [
    "Nez Perce",
    "Nez Perce Tribe of Idaho"
  ],
  "kind": "us-federally-recognized-tribe",
  "country": "US",
  "jurisdictions": [
    "ID"
  ],
  "region": "id",
  "hq": {
    "lat": 46.3999,
    "lon": -116.8049,
    "precision": "office",
    "sourceId": "bia-tld",
    "sourceRecordId": "363",
    "retrievedAt": "2026-10-04",
    "reviewed": true
  },
  "samples": [
    [
      46.3999,
      -116.8049
    ],
    [
      46.31767,
      -116.40333
    ]
  ],
  "bbox": [
    -116.91212,
    45.99263,
    -115.89652,
    46.56534
  ],
  "boundary": {
    "status": "polygon",
    "detailRef": "geo/boundaries/us-id-nez-perce-tribe.json",
    "parts": [
      {
        "sourceId": "bia-lar",
        "featureId": "LAR0072",
        "kind": "land-area-representation",
        "vintage": "2026-10-04"
      }
    ]
  },
  "timeZone": "America/Los_Angeles",
  "timeZoneSource": "tz-lookup",
  "units": "us",
  "nws": {
    "wfo": [
      "OTX",
      "MSO"
    ],
    "point": [
      46.3999,
      -116.8049
    ],
    "forecastZones": [
      "forecast:IDZ026",
      "forecast:IDZ027",
      "forecast:IDZ007"
    ],
    "countyZones": [
      "county:IDC069",
      "county:IDC061",
      "county:IDC049",
      "county:IDC035"
    ],
    "fireZones": [
      "fire:IDZ102"
    ],
    "marineZones": []
  },
  "eccc": null,
  "radar": {
    "nexrad": "KOTX",
    "ridgeLoop": "KOTX",
    "eccc": null
  },
  "gauges": [
    "nwps:SPDI1",
    "nwps:PRII1",
    "nwps:PEKI1",
    "nwps:ACAW1",
    "nwps:WAHI1",
    "nwps:ORFI1"
  ],
  "contactIds": [],
  "website": null,
  "isc": null,
  "codes": {
    "biaLarIds": [
      "LAR0072"
    ],
    "censusAiannhce": [
      "2445"
    ],
    "censusGeoid": "2445R",
    "biaTldObjectId": 363,
    "biaAnvObjectId": null,
    "iscBandNumber": null
  },
  "review": {
    "status": "reviewed",
    "reviewedAt": "2026-10-05",
    "notes": "Approved with amendments 10/05/2026 (packet-amendments-2026-10-05.md; approver: maintainer). Footprint basis: state Idaho (whole state is in the footprint)."
  },
  "flags": []
}
